{
  "version": "source-grounded-draft.v1",
  "authority": "codex_prepared_unreviewed",
  "product": {
    "id": "draft.p24",
    "manufacturer": "Epoch Batteries",
    "model": "B24100A-C",
    "manufacturer_part_number": "B24100A-C",
    "hardware_revision": null
  },
  "intended_use": "24 V class house storage with explicit voltage, current-duration, cell/heater and bank matching constraints",
  "sources": [
    {
      "id": "p24",
      "url": "https://www.epochbatteries.com/products/24v-100ah-marine-lithium-battery",
      "publisher": "Epoch Batteries",
      "retrieved_at": "2026-10-13T05:13:24.875Z",
      "content_digest": "sha256:14bdb4593f47477ab398b7da5153ee91f9390b89d366ba5b79ac4b7163ce4b53",
      "document_revision": null,
      "model": "B24100A-C",
      "identity_locator": "Technical Specifications & Dimensions / Model SKU B24100A-C",
      "rights": "metadata_and_limited_facts_only",
      "redistribution_grant": "not_established"
    }
  ],
  "facts": [
    {
      "id": "draft.p24.nominal_voltage.0",
      "quantity": "nominal_voltage",
      "basis": "nominal",
      "mode": "all",
      "direction": "none",
      "electrical_domain": "dc",
      "original": {
        "value": "25.6",
        "unit": "V",
        "presentation": "source_literal"
      },
      "normalized": {
        "value": 25.6,
        "unit": "V"
      },
      "normalization": "identity",
      "source_id": "p24",
      "locator": "HTML Technical Specifications & Dimensions / Nominal voltage",
      "context_digest": "sha256:14bdb4593f47477ab398b7da5153ee91f9390b89d366ba5b79ac4b7163ce4b53",
      "conditions": [],
      "unresolved_conditions": [],
      "disposition": "retained_source_fact"
    },
    {
      "id": "draft.p24.system_voltage_class.1",
      "quantity": "system_voltage_class",
      "basis": "nominal",
      "mode": "all",
      "direction": "none",
      "electrical_domain": "dc",
      "original": {
        "value": "24",
        "unit": "V",
        "presentation": "source_literal"
      },
      "normalized": {
        "value": 24,
        "unit": "V"
      },
      "normalization": "identity",
      "source_id": "p24",
      "locator": "HTML Technical Specifications & Dimensions / Nominal voltage",
      "context_digest": "sha256:14bdb4593f47477ab398b7da5153ee91f9390b89d366ba5b79ac4b7163ce4b53",
      "conditions": [],
      "unresolved_conditions": [],
      "disposition": "retained_source_fact"
    },
    {
      "id": "draft.p24.capacity.2",
      "quantity": "capacity",
      "basis": "nominal",
      "mode": "all",
      "direction": "none",
      "electrical_domain": "none",
      "original": {
        "value": "100",
        "unit": "Ah",
        "presentation": "source_literal"
      },
      "normalized": {
        "value": 100,
        "unit": "Ah"
      },
      "normalization": "identity",
      "source_id": "p24",
      "locator": "HTML Technical Specifications & Dimensions / Nominal capacity",
      "context_digest": "sha256:14bdb4593f47477ab398b7da5153ee91f9390b89d366ba5b79ac4b7163ce4b53",
      "conditions": [],
      "unresolved_conditions": [],
      "disposition": "retained_source_fact"
    },
    {
      "id": "draft.p24.energy.3",
      "quantity": "energy",
      "basis": "nominal",
      "mode": "all",
      "direction": "none",
      "electrical_domain": "none",
      "original": {
        "value": "2.56",
        "unit": "kWh",
        "presentation": "source_literal"
      },
      "normalized": {
        "value": 2560,
        "unit": "Wh"
      },
      "normalization": "kwh_to_wh",
      "source_id": "p24",
      "locator": "HTML Technical Specifications & Dimensions / Energy stored",
      "context_digest": "sha256:14bdb4593f47477ab398b7da5153ee91f9390b89d366ba5b79ac4b7163ce4b53",
      "conditions": [],
      "unresolved_conditions": [],
      "disposition": "retained_source_fact"
    },
    {
      "id": "draft.p24.chemistry.4",
      "quantity": "chemistry",
      "basis": "descriptive",
      "mode": "all",
      "direction": "none",
      "electrical_domain": "none",
      "original": {
        "value": "LiFePO4",
        "unit": "text",
        "presentation": "authored_summary"
      },
      "normalized": {
        "value": "LiFePO4",
        "unit": "text"
      },
      "normalization": "identity",
      "source_id": "p24",
      "locator": "HTML Technical Specifications & Dimensions / Chemistry",
      "context_digest": "sha256:14bdb4593f47477ab398b7da5153ee91f9390b89d366ba5b79ac4b7163ce4b53",
      "conditions": [],
      "unresolved_conditions": [],
      "disposition": "retained_source_fact"
    },
    {
      "id": "draft.p24.cell_configuration.5",
      "quantity": "cell_configuration",
      "basis": "descriptive",
      "mode": "all",
      "direction": "none",
      "electrical_domain": "none",
      "original": {
        "value": "8S",
        "unit": "text",
        "presentation": "authored_summary"
      },
      "normalized": {
        "value": "8S",
        "unit": "text"
      },
      "normalization": "identity",
      "source_id": "p24",
      "locator": "HTML Technical Specifications & Dimensions / Cell configuration",
      "context_digest": "sha256:14bdb4593f47477ab398b7da5153ee91f9390b89d366ba5b79ac4b7163ce4b53",
      "conditions": [],
      "unresolved_conditions": [],
      "disposition": "retained_source_fact"
    },
    {
      "id": "draft.p24.operating_voltage_range.6",
      "quantity": "operating_voltage_range",
      "basis": "operating",
      "mode": "battery",
      "direction": "bidirectional",
      "electrical_domain": "dc",
      "original": {
        "value": "{\"min\":20,\"max\":29.2}",
        "unit": "V",
        "presentation": "source_value_reconstruction"
      },
      "normalized": {
        "value": {
          "min": 20,
          "max": 29.2
        },
        "unit": "V"
      },
      "normalization": "identity",
      "source_id": "p24",
      "locator": "HTML Technical Specifications & Dimensions / Operating voltage range",
      "context_digest": "sha256:14bdb4593f47477ab398b7da5153ee91f9390b89d366ba5b79ac4b7163ce4b53",
      "conditions": [],
      "unresolved_conditions": [],
      "disposition": "typed_consumer"
    },
    {
      "id": "draft.p24.charge_voltage_max.7",
      "quantity": "charge_voltage_max",
      "basis": "absolute",
      "mode": "charge",
      "direction": "input",
      "electrical_domain": "dc",
      "original": {
        "value": "29.2",
        "unit": "V",
        "presentation": "source_literal"
      },
      "normalized": {
        "value": 29.2,
        "unit": "V"
      },
      "normalization": "identity",
      "source_id": "p24",
      "locator": "HTML Technical Specifications & Dimensions / Maximum charge voltage",
      "context_digest": "sha256:14bdb4593f47477ab398b7da5153ee91f9390b89d366ba5b79ac4b7163ce4b53",
      "conditions": [],
      "unresolved_conditions": [],
      "disposition": "typed_consumer"
    },
    {
      "id": "draft.p24.discharge_current.8",
      "quantity": "discharge_current",
      "basis": "continuous",
      "mode": "discharge",
      "direction": "output",
      "electrical_domain": "dc",
      "original": {
        "value": "120",
        "unit": "A",
        "presentation": "source_literal"
      },
      "normalized": {
        "value": 120,
        "unit": "A"
      },
      "normalization": "identity",
      "source_id": "p24",
      "locator": "HTML Technical Specifications & Dimensions / Max continuous discharge",
      "context_digest": "sha256:14bdb4593f47477ab398b7da5153ee91f9390b89d366ba5b79ac4b7163ce4b53",
      "conditions": [],
      "unresolved_conditions": [],
      "disposition": "typed_consumer"
    },
    {
      "id": "draft.p24.recommended_charge_current.9",
      "quantity": "recommended_charge_current",
      "basis": "recommended",
      "mode": "charge",
      "direction": "input",
      "electrical_domain": "dc",
      "original": {
        "value": "50",
        "unit": "A",
        "presentation": "source_literal"
      },
      "normalized": {
        "value": 50,
        "unit": "A"
      },
      "normalization": "identity",
      "source_id": "p24",
      "locator": "HTML Technical Specifications & Dimensions / Continuous charge current",
      "context_digest": "sha256:14bdb4593f47477ab398b7da5153ee91f9390b89d366ba5b79ac4b7163ce4b53",
      "conditions": [],
      "unresolved_conditions": [],
      "disposition": "retained_source_fact"
    },
    {
      "id": "draft.p24.charge_current.10",
      "quantity": "charge_current",
      "basis": "peak",
      "mode": "charge_peak",
      "direction": "input",
      "electrical_domain": "dc",
      "original": {
        "value": "150",
        "unit": "A",
        "presentation": "source_literal"
      },
      "normalized": {
        "value": 150,
        "unit": "A"
      },
      "normalization": "identity",
      "source_id": "p24",
      "locator": "HTML Technical Specifications & Dimensions / Max charge current",
      "context_digest": "sha256:14bdb4593f47477ab398b7da5153ee91f9390b89d366ba5b79ac4b7163ce4b53",
      "conditions": [
        {
          "key": "duration_s",
          "value": {
            "min": 0,
            "max": 10
          },
          "unit": "s"
        }
      ],
      "unresolved_conditions": [
        "Peak reset/repetition duty and current/thermal prerequisites unproven"
      ],
      "disposition": "typed_consumer"
    },
    {
      "id": "draft.p24.discharge_current.11",
      "quantity": "discharge_current",
      "basis": "peak",
      "mode": "discharge_peak",
      "direction": "output",
      "electrical_domain": "dc",
      "original": {
        "value": "200",
        "unit": "A",
        "presentation": "source_literal"
      },
      "normalized": {
        "value": 200,
        "unit": "A"
      },
      "normalization": "identity",
      "source_id": "p24",